ffff8803675b44c0 2309752748 C Ii:6:002:2 0:1 20 = 11ff0f4e 00100000 00000000 00000000 00000000
ffff880809d67280 2309753021 S Ii:6:002:2 -115:1 64 <
ffff8807c1c95940 2309754108 S Co:6:002:0 s 21 09 0211 0001 0014 20 = 11ff0f3e 00100002 023e007c 013e007c 00000000
ffff8807c1c95940 2309754749 C Co:6:002:0 0 20 >
ffff880809d67280 2309757749 C Ii:6:002:2 0:1 20 = 11ff0f3e 00100002 00000000 00000000 00000000
ffff88060a3907c0 2309757918 S Ii:6:002:2 -115:1 64 <
ffff88060090a040 2309759052 S Co:6:002:0 s 21 09 0211 0001 0014 20 = 11ff0f5e 00000000 00000000 00000000 00000000
ffff88060090a040 2309759749 C Co:6:002:0 0 20 >
ffff88060a3907c0 2309761748 C Ii:6:002:2 0:1 20 = 11ff0900 00000000 00000000 00000000 00000000
ffff88080c8da880 2309761978 S Ii:6:002:2 -115:1 64 <
ffff88080c8da880 2309763748 C Ii:6:002:2 0:1 20 = 11ff0f5e 00000000 00000000 00000000 00000000
ffff88080c8da880 2309764008 S Ii:6:002:2 -115:1 64 <
ffff880531565340 2309766142 S Co:6:002:0 s 21 09 0211 0001 0014 20 = 11ff091e 01000000 00000000 00000000 00000000
ffff880531565340 2309766748 C Co:6:002:0 0 20 >
ffff88080c8da880 2309769749 C Ii:6:002:2 0:1 20 = 11ff091e 01000000 00000000 00000000 00000000
ffff880531565340 2309769916 S Ii:6:002:2 -115:1 64 <
ffff8807c1c95940 2309772308 S Co:6:002:0 s 21 09 0211 0001 0014 20 = 11ff091e 01000000 00000000 00000000 00000000
ffff8807c1c95940 2309772749 C Co:6:002:0 0 20 >
ffff880531565340 2309775748 C Ii:6:002:2 0:1 20 = 11ff091e 01000000 00000000 00000000 00000000
ffff8803675b44c0 2309776116 S Ii:6:002:2 -115:1 64 <
ffff8803675b44c0 2311411734 C Ii:6:002:2 0:1 20 = 11ff0900 02000000 00000000 00000000 00000000
ffff88060090a040 2311412142 S Ii:6:002:2 -115:1 64 <
ffff880809d67280 2311415257 S Co:6:002:0 s 21 09 0211 0001 0014 20 = 11ff091e 02000000 00000000 00000000 00000000
ffff880809d67280 2311415726 C Co:6:002:0 0 20 >
ffff88060090a040 2311418727 C Ii:6:002:2 0:1 20 = 11ff091e 02000000 00000000 00000000 00000000
ffff8802f29a4040 2311419205 S Ii:6:002:2 -115:1 64 <
ffff8803a02efc40 2311421967 S Co:6:002:0 s 21 09 0211 0001 0014 20 = 11ff091e 02000000 00000000 00000000 00000000
ffff8803a02efc40 2311422729 C Co:6:002:0 0 20 >
ffff8802f29a4040 2311425724 C Ii:6:002:2 0:1 20 = 11ff091e 02000000 00000000 00000000 00000000
ffff880382a87280 2311426131 S Ii:6:002:2 -115:1 64 <
ffff8806ab677f40 2311427218 S Co:6:002:0 s 21 09 0211 0001 0014 20 = 11ff0a0e 00000000 00000000 00000000 00000000
ffff8806ab677f40 2311427722 C Co:6:002:0 0 20 >
ffff880382a87280 2311430723 C Ii:6:002:2 0:1 20 = 11ff0a0e 00000000 00000000 00000000 00000000
ffff880641a41e80 2311431140 S Ii:6:002:2 -115:1 64 <
ffff8803675b41c0 2311433260 S Co:6:002:0 s 21 09 0211 0001 0014 20 = 11ff0f4e 00010000 00000000 00000000 00000000
ffff8803675b41c0 2311433720 C Co:6:002:0 0 20 >
ffff880641a41e80 2311437722 C Ii:6:002:2 0:1 20 = 11ff0f4e 00010000 00000000 00000000 00000000
ffff8803675b4700 2311438077 S Ii:6:002:2 -115:1 64 <
ffff8806ab677580 2311448777 S Co:6:002:0 s 21 09 0211 0001 0014 20 = 11ff0f4e 00040000 00000000 00000000 00000000
ffff8806ab677580 2311449721 C Co:6:002:0 0 20 >
ffff8803675b4700 2311451722 C Ii:6:002:2 0:1 20 = 11ff0f4e 00040000 00000000 00000000 00000000
ffff8806ab677580 2311451992 S Ii:6:002:2 -115:1 64 <
ffff8803675b4700 2311453271 S Co:6:002:0 s 21 09 0211 0001 0014 20 = 11ff0f4e 00020100 00000000 00000000 00000000
ffff8803675b4700 2311453721 C Co:6:002:0 0 20 >
ffff8806ab677580 2311456725 C Ii:6:002:2 0:1 20 = 11ff0f4e 00020100 00000000 00000000 00000000
ffff8806ab677580 2311457301 S Ii:6:002:2 -115:1 64 <
ffff880382a874c0 2311460100 S Co:6:002:0 s 21 09 0211 0001 0014 20 = 11ff0f4e 00400000 00000000 00000000 00000000
ffff880382a874c0 2311460723 C Co:6:002:0 0 20 >
ffff8806ab677580 2311463722 C Ii:6:002:2 0:1 20 = 11ff0f4e 00400000 00000000 00000000 00000000
ffff8805fe5f1b80 2311464098 S Ii:6:002:2 -115:1 64 <
ffff880382a87b80 2311465285 S Co:6:002:0 s 21 09 0211 0001 0014 20 = 11ff0f4e 00040000 00000000 00000000 00000000
ffff880382a87b80 2311465721 C Co:6:002:0 0 20 >
ffff8805fe5f1b80 2311468720 C Ii:6:002:2 0:1 20 = 11ff0f4e 00040000 00000000 00000000 00000000
ffff880647d6b280 2311469173 S Ii:6:002:2 -115:1 64 <
ffff880641a41e80 2311472315 S Co:6:002:0 s 21 09 0212 0001 0040 64 = 12ff0f3e 00040009 02ffffff 05ffffff 04ffffff 07ffffff 06ffffff 09ffffff
ffff880641a41e80 2311472723 C Co:6:002:0 0 64 >
ffff880647d6b280 2311474719 C Ii:6:002:2 0:1 20 = 11ff0f3e 00040009 00000000 00000000 00000000
ffff88080c8da880 2311475656 S Ii:6:002:2 -115:1 64 <
ffff880647d6b280 2311477622 S Co:6:002:0 s 21 09 0211 0001 0014 20 = 11ff0f4e 00010000 00000000 00000000 00000000
ffff880647d6b280 2311478724 C Co:6:002:0 0 20 >
ffff88080c8da880 2311481721 C Ii:6:002:2 0:1 20 = 11ff0f4e 00010000 00000000 00000000 00000000
ffff880641a41e80 2311482312 S Ii:6:002:2 -115:1 64 <
ffff88080c8da880 2311497079 S Co:6:002:0 s 21 09 0212 0001 0040 64 = 12ff0f3e 0001000e 4dea00ff 4cff8187 4f0000ff 4eff0000 41ff00bb 40ff00bb
ffff88080c8da880 2311497725 C Co:6:002:0 0 64 >
ffff880641a41e80 2311499720 C Ii:6:002:2 0:1 20 = 11ff0f3e 0001000e 00000000 00000000 00000000
ffff8805fe5f1b80 2311499963 S Ii:6:002:2 -115:1 64 <
ffff880382a87b80 2311501310 S Co:6:002:0 s 21 09 0212 0001 0040 64 = 12ff0f3e 0001000e 5b80f8a0 5a80f8a0 5d80f8a0 5c80f8a0 5f80f8a0 5e80f8a0
ffff880382a87b80 2311501723 C Co:6:002:0 0 64 >
ffff8805fe5f1b80 2311503722 C Ii:6:002:2 0:1 20 = 11ff0f3e 0001000e 00000000 00000000 00000000
ffff880641a41e80 2311503982 S Ii:6:002:2 -115:1 64 <
ffff88080c8da880 2311506228 S Co:6:002:0 s 21 09 0212 0001 0040 64 = 12ff0f3e 0001000e 6180f8a0 6080f8a0 6380f8a0 e100ff00 6280f8a0 6500ff00
ffff88080c8da880 2311506898 C Co:6:002:0 0 64 >
ffff880641a41e80 2311508720 C Ii:6:002:2 0:1 20 = 11ff0f3e 0001000e 00000000 00000000 00000000
ffff880647d6b280 2311509173 S Ii:6:002:2 -115:1 64 <
ffff8803675b41c0 2311510389 S Co:6:002:0 s 21 09 0212 0001 0040 64 = 12ff0f3e 0001000e 08ff8000 0bff8000 0aff8000 0dff8000 0cff8000 0fff8000
ffff8803675b41c0 2311510721 C Co:6:002:0 0 64 >
