ffff88080bab7340 2309622759 C Ii:6:002:2 0:1 20 = 11ff0900 01000000 00000000 00000000 00000000
ffff88080bab7340 2309623082 S Ii:6:002:2 -115:1 64 <
ffff8802f29a4400 2309624196 S Co:6:002:0 s 21 09 0211 0001 0014 20 = 11ff091e 01000000 00000000 00000000 00000000
ffff8802f29a4400 2309624752 C Co:6:002:0 0 20 >
ffff88080bab7340 2309627755 C Ii:6:002:2 0:1 20 = 11ff091e 01000000 00000000 00000000 00000000
ffff880366cb6d00 2309627938 S Ii:6:002:2 -115:1 64 <
ffff88060bcd7940 2309630021 S Co:6:002:0 s 21 09 0211 0001 0014 20 = 11ff091e 01000000 00000000 00000000 00000000
ffff88060bcd7940 2309630753 C Co:6:002:0 0 20 >
ffff880366cb6d00 2309633751 C Ii:6:002:2 0:1 20 = 11ff091e 01000000 00000000 00000000 00000000
ffff880382a87040 2309633910 S Ii:6:002:2 -115:1 64 <
ffff880641a2e400 2309635117 S Co:6:002:0 s 21 09 0211 0001 0014 20 = 11ff0a0e 00000000 00000000 00000000 00000000
ffff880641a2e400 2309635752 C Co:6:002:0 0 20 >
ffff880382a87040 2309638753 C Ii:6:002:2 0:1 20 = 11ff0a0e 00000000 00000000 00000000 00000000
ffff880382a87a00 2309638930 S Ii:6:002:2 -115:1 64 <
ffff880382a87dc0 2309639977 S Co:6:002:0 s 21 09 0211 0001 0014 20 = 11ff0f4e 00010000 00000000 00000000 00000000
ffff880382a87dc0 2309640751 C Co:6:002:0 0 20 >
ffff880382a87a00 2309644755 C Ii:6:002:2 0:1 20 = 11ff0f4e 00010000 00000000 00000000 00000000
ffff880382a87400 2309645089 S Ii:6:002:2 -115:1 64 <
ffff880647d6b640 2309664366 S Co:6:002:0 s 21 09 0211 0001 0014 20 = 11ff0f4e 00040000 00000000 00000000 00000000
ffff880647d6b640 2309664755 C Co:6:002:0 0 20 >
ffff880382a87400 2309667751 C Ii:6:002:2 0:1 20 = 11ff0f4e 00040000 00000000 00000000 00000000
ffff88060bcd7580 2309667890 S Ii:6:002:2 -115:1 64 <
ffff880382a87700 2309668953 S Co:6:002:0 s 21 09 0211 0001 0014 20 = 11ff0f4e 00020100 00000000 00000000 00000000
ffff880382a87700 2309669751 C Co:6:002:0 0 20 >
ffff88060bcd7580 2309672752 C Ii:6:002:2 0:1 20 = 11ff0f4e 00020100 00000000 00000000 00000000
ffff88064a199f40 2309673008 S Ii:6:002:2 -115:1 64 <
ffff88080bab7e80 2309674760 S Co:6:002:0 s 21 09 0211 0001 0014 20 = 11ff0f4e 00400000 00000000 00000000 00000000
ffff88080bab7e80 2309675754 C Co:6:002:0 0 20 >
ffff88064a199f40 2309677752 C Ii:6:002:2 0:1 20 = 11ff0f4e 00400000 00000000 00000000 00000000
ffff88060bcd7040 2309678084 S Ii:6:002:2 -115:1 64 <
ffff880382a87100 2309680037 S Co:6:002:0 s 21 09 0211 0001 0014 20 = 11ff0f4e 00040000 00000000 00000000 00000000
ffff880382a87100 2309680753 C Co:6:002:0 0 20 >
ffff88060bcd7040 2309683752 C Ii:6:002:2 0:1 20 = 11ff0f4e 00040000 00000000 00000000 00000000
ffff880382a871c0 2309683963 S Ii:6:002:2 -115:1 64 <
ffff8803675b4a00 2309686100 S Co:6:002:0 s 21 09 0212 0001 0040 64 = 12ff0f3e 00040009 02ffffff 05ffffff 04ffffff 07ffffff 06ffffff 09ffffff
ffff8803675b4a00 2309686751 C Co:6:002:0 0 64 >
ffff880382a871c0 2309688752 C Ii:6:002:2 0:1 20 = 11ff0f3e 00040009 00000000 00000000 00000000
ffff880382a87280 2309689020 S Ii:6:002:2 -115:1 64 <
ffff8806ab677580 2309691193 S Co:6:002:0 s 21 09 0211 0001 0014 20 = 11ff0f4e 00010000 00000000 00000000 00000000
ffff8806ab677580 2309691752 C Co:6:002:0 0 20 >
ffff880382a87280 2309695752 C Ii:6:002:2 0:1 20 = 11ff0f4e 00010000 00000000 00000000 00000000
ffff8802f29a4040 2309696003 S Ii:6:002:2 -115:1 64 <
ffff880382a87280 2309714627 S Co:6:002:0 s 21 09 0212 0001 0040 64 = 12ff0f3e 0001000e 4dea00ff 4cff8187 4f0000ff 4eff0000 41ff00bb 40ff00bb
ffff880382a87280 2309715753 C Co:6:002:0 0 64 >
ffff8802f29a4040 2309716749 C Ii:6:002:2 0:1 20 = 11ff0f3e 0001000e 00000000 00000000 00000000
ffff880382a87280 2309717050 S Ii:6:002:2 -115:1 64 <
ffff880382a874c0 2309718052 S Co:6:002:0 s 21 09 0212 0001 0040 64 = 12ff0f3e 0001000e 5b80f8a0 5a80f8a0 5d80f8a0 5c80f8a0 5f80f8a0 5e80f8a0
ffff880382a874c0 2309718749 C Co:6:002:0 0 64 >
ffff880382a87280 2309720749 C Ii:6:002:2 0:1 20 = 11ff0f3e 0001000e 00000000 00000000 00000000
ffff880382a87280 2309721287 S Ii:6:002:2 -115:1 64 <
ffff880641a41e80 2309722897 S Co:6:002:0 s 21 09 0212 0001 0040 64 = 12ff0f3e 0001000e 6180f8a0 6080f8a0 6380f8a0 e100ff00 6280f8a0 6500ff00
ffff880641a41e80 2309723751 C Co:6:002:0 0 64 >
ffff880382a87280 2309725751 C Ii:6:002:2 0:1 20 = 11ff0f3e 0001000e 00000000 00000000 00000000
ffff880382a87280 2309726130 S Ii:6:002:2 -115:1 64 <
ffff8806ab677f40 2309728104 S Co:6:002:0 s 21 09 0212 0001 0040 64 = 12ff0f3e 0001000e 08ff8000 0bff8000 0aff8000 0dff8000 0cff8000 0fff8000
ffff8806ab677f40 2309728753 C Co:6:002:0 0 64 >
ffff880382a87280 2309730751 C Ii:6:002:2 0:1 20 = 11ff0f3e 0001000e 00000000 00000000 00000000
ffff88080bab7040 2309731898 S Ii:6:002:2 -115:1 64 <
ffff8803a02efc40 2309733776 S Co:6:002:0 s 21 09 0212 0001 0040 64 = 12ff0f3e 0001000e 1aff0000 1dff8000 1cff8000 1fffff00 1effff00 11ff8000
ffff8803a02efc40 2309734749 C Co:6:002:0 0 64 >
ffff88080bab7040 2309735750 C Ii:6:002:2 0:1 20 = 11ff0f3e 0001000e 00000000 00000000 00000000
ffff8806ab677c40 2309735957 S Ii:6:002:2 -115:1 64 <
ffff88069d784640 2309737032 S Co:6:002:0 s 21 09 0212 0001 0040 64 = 12ff0f3e 0001000e 28aa00ff 2baa00ff 2aaa00ff 2d00ffae 2caa00ff 2f00ffae
ffff88069d784640 2309737749 C Co:6:002:0 0 64 >
ffff8806ab677c40 2309739748 C Ii:6:002:2 0:1 20 = 11ff0f3e 0001000e 00000000 00000000 00000000
ffff88080bab7940 2309740011 S Ii:6:002:2 -115:1 64 <
ffff88080bab7700 2309741203 S Co:6:002:0 s 21 09 0212 0001 0040 64 = 12ff0f3e 0001000e 26ffff00 3900ff00 3800ffae 3bff00bb 3aff00bb 3dff00bb
ffff88080bab7700 2309741750 C Co:6:002:0 0 64 >
ffff88080bab7940 2309743749 C Ii:6:002:2 0:1 20 = 11ff0f3e 0001000e 00000000 00000000 00000000
ffff8803675b4280 2309743977 S Ii:6:002:2 -115:1 64 <
ffff8803675b4ac0 2309744975 S Co:6:002:0 s 21 09 0212 0001 0040 64 = 12ff0f3e 00010006 3700ffae 3600ffae 49ff8187 48bfff00 4bff0000 4aea00ff
ffff8803675b4ac0 2309745748 C Co:6:002:0 0 64 >
ffff8803675b4280 2309747748 C Ii:6:002:2 0:1 20 = 11ff0f3e 00010006 00000000 00000000 00000000
ffff8803675b44c0 2309747959 S Ii:6:002:2 -115:1 64 <
ffff880809d67b80 2309749040 S Co:6:002:0 s 21 09 0211 0001 0014 20 = 11ff0f4e 00100000 00000000 00000000 00000000
ffff880809d67b80 2309749749 C Co:6:002:0 0 20 >
