ffff880647d6b280 2311512721 C Ii:6:002:2 0:1 20 = 11ff0f3e 0001000e 00000000 00000000 00000000
ffff880382a87280 2311513295 S Ii:6:002:2 -115:1 64 <
ffff8806ab677f40 2311514494 S Co:6:002:0 s 21 09 0212 0001 0040 64 = 12ff0f3e 0001000e 1aff0000 1dff8000 1cff8000 1fffff00 1effff00 11ff8000
ffff8806ab677f40 2311514723 C Co:6:002:0 0 64 >
ffff880382a87280 2311516721 C Ii:6:002:2 0:1 20 = 11ff0f3e 0001000e 00000000 00000000 00000000
ffff880647d6bc40 2311517376 S Ii:6:002:2 -115:1 64 <
ffff8803675b4340 2311518815 S Co:6:002:0 s 21 09 0212 0001 0040 64 = 12ff0f3e 0001000e 28aa00ff 2baa00ff 2aaa00ff 2d00ffae 2caa00ff 2f00ffae
ffff8803675b4340 2311519721 C Co:6:002:0 0 64 >
ffff880647d6bc40 2311521725 C Ii:6:002:2 0:1 20 = 11ff0f3e 0001000e 00000000 00000000 00000000
ffff8803675b4880 2311522530 S Ii:6:002:2 -115:1 64 <
ffff8803675b4b80 2311524334 S Co:6:002:0 s 21 09 0212 0001 0040 64 = 12ff0f3e 0001000e 26ffff00 3900ff00 3800ffae 3bff00bb 3aff00bb 3dff00bb
ffff8803675b4b80 2311524719 C Co:6:002:0 0 64 >
ffff8803675b4880 2311526722 C Ii:6:002:2 0:1 20 = 11ff0f3e 0001000e 00000000 00000000 00000000
ffff880647d6b100 2311527268 S Ii:6:002:2 -115:1 64 <
ffff88060bcd7a00 2311528439 S Co:6:002:0 s 21 09 0212 0001 0040 64 = 12ff0f3e 00010006 3700ffae 3600ffae 49ff8187 48bfff00 4bff0000 4aea00ff
ffff88060bcd7a00 2311528722 C Co:6:002:0 0 64 >
ffff880647d6b100 2311530726 C Ii:6:002:2 0:1 20 = 11ff0f3e 00010006 00000000 00000000 00000000
ffff8800b80c9700 2311531093 S Ii:6:002:2 -115:1 64 <
ffff8807ed280e80 2311532285 S Co:6:002:0 s 21 09 0211 0001 0014 20 = 11ff0f4e 00100000 00000000 00000000 00000000
ffff8807ed280e80 2311532724 C Co:6:002:0 0 20 >
ffff8800b80c9700 2311535719 C Ii:6:002:2 0:1 20 = 11ff0f4e 00100000 00000000 00000000 00000000
ffff8803675b4640 2311536096 S Ii:6:002:2 -115:1 64 <
ffff8800b80c9700 2311537310 S Co:6:002:0 s 21 09 0211 0001 0014 20 = 11ff0f3e 00100002 023e007c 013e007c 00000000
ffff8800b80c9700 2311537722 C Co:6:002:0 0 20 >
ffff8803675b4640 2311540720 C Ii:6:002:2 0:1 20 = 11ff0f3e 00100002 00000000 00000000 00000000
ffff880382a87280 2311541146 S Ii:6:002:2 -115:1 64 <
ffff8802f29a4040 2311542217 S Co:6:002:0 s 21 09 0211 0001 0014 20 = 11ff0f5e 00000000 00000000 00000000 00000000
ffff8802f29a4040 2311542721 C Co:6:002:0 0 20 >
ffff880382a87280 2311545719 C Ii:6:002:2 0:1 20 = 11ff0f5e 00000000 00000000 00000000 00000000
ffff8803a02efc40 2311546076 S Ii:6:002:2 -115:1 64 <
ffff88060090a040 2311548217 S Co:6:002:0 s 21 09 0211 0001 0014 20 = 11ff091e 02000000 00000000 00000000 00000000
ffff88060090a040 2311548725 C Co:6:002:0 0 20 >
ffff8803a02efc40 2311551722 C Ii:6:002:2 0:1 20 = 11ff091e 02000000 00000000 00000000 00000000
ffff880809d67280 2311552218 S Ii:6:002:2 -115:1 64 <
ffff880809d67280 2311569723 C Ii:6:002:2 0:1 20 = 11ff0900 00000000 00000000 00000000 00000000
ffff8803675b44c0 2311569931 S Ii:6:002:2 -115:1 64 <
ffff880809d67b80 2311571009 S Co:6:002:0 s 21 09 0211 0001 0014 20 = 11ff091e 02000000 00000000 00000000 00000000
ffff880809d67b80 2311571718 C Co:6:002:0 0 20 >
ffff8803675b44c0 2311574724 C Ii:6:002:2 0:1 20 = 11ff091e 02000000 00000000 00000000 00000000
ffff880809d67280 2311574917 S Ii:6:002:2 -115:1 64 <
ffff880809d67280 2312925698 C Ii:6:002:2 0:1 20 = 11ff0900 04000000 00000000 00000000 00000000
ffff8803a02efc40 2312926046 S Ii:6:002:2 -115:1 64 <
ffff88060090a040 2312928027 S Co:6:002:0 s 21 09 0211 0001 0014 20 = 11ff091e 04000000 00000000 00000000 00000000
ffff88060090a040 2312928694 C Co:6:002:0 0 20 >
ffff8803a02efc40 2312931692 C Ii:6:002:2 0:1 20 = 11ff091e 04000000 00000000 00000000 00000000
ffff8803a02efc40 2312931937 S Ii:6:002:2 -115:1 64 <
ffff88060090a040 2312934500 S Co:6:002:0 s 21 09 0211 0001 0014 20 = 11ff091e 04000000 00000000 00000000 00000000
ffff88060090a040 2312934693 C Co:6:002:0 0 20 >
ffff8803a02efc40 2312937692 C Ii:6:002:2 0:1 20 = 11ff091e 04000000 00000000 00000000 00000000
ffff880382a87280 2312937927 S Ii:6:002:2 -115:1 64 <
ffff8802f29a4040 2312939580 S Co:6:002:0 s 21 09 0211 0001 0014 20 = 11ff0a0e 00000000 00000000 00000000 00000000
ffff8802f29a4040 2312940694 C Co:6:002:0 0 20 >
ffff880382a87280 2312942696 C Ii:6:002:2 0:1 20 = 11ff0a0e 00000000 00000000 00000000 00000000
ffff8803675b4640 2312942882 S Ii:6:002:2 -115:1 64 <
ffff8800b80c9700 2312944117 S Co:6:002:0 s 21 09 0211 0001 0014 20 = 11ff0f4e 00010000 00000000 00000000 00000000
ffff8800b80c9700 2312944693 C Co:6:002:0 0 20 >
ffff8803675b4640 2312948692 C Ii:6:002:2 0:1 20 = 11ff0f4e 00010000 00000000 00000000 00000000
ffff8807ed280e80 2312948883 S Ii:6:002:2 -115:1 64 <
ffff88060a3907c0 2312961543 S Co:6:002:0 s 21 09 0211 0001 0014 20 = 11ff0f4e 00040000 00000000 00000000 00000000
ffff88060a3907c0 2312962693 C Co:6:002:0 0 20 >
ffff8807ed280e80 2312964692 C Ii:6:002:2 0:1 20 = 11ff0f4e 00040000 00000000 00000000 00000000
ffff8806d91ce340 2312964938 S Ii:6:002:2 -115:1 64 <
ffff8807ed280e80 2312966044 S Co:6:002:0 s 21 09 0211 0001 0014 20 = 11ff0f4e 00020100 00000000 00000000 00000000
ffff8807ed280e80 2312966693 C Co:6:002:0 0 20 >
ffff8806d91ce340 2312969692 C Ii:6:002:2 0:1 20 = 11ff0f4e 00020100 00000000 00000000 00000000
ffff88080da91f40 2312969931 S Ii:6:002:2 -115:1 64 <
ffff8803a02efac0 2312971081 S Co:6:002:0 s 21 09 0211 0001 0014 20 = 11ff0f4e 00400000 00000000 00000000 00000000
ffff8803a02efac0 2312971697 C Co:6:002:0 0 20 >
ffff88080da91f40 2312974692 C Ii:6:002:2 0:1 20 = 11ff0f4e 00400000 00000000 00000000 00000000
ffff8803a02ef940 2312974934 S Ii:6:002:2 -115:1 64 <
ffff8806ab677ac0 2312976190 S Co:6:002:0 s 21 09 0211 0001 0014 20 = 11ff0f4e 00040000 00000000 00000000 00000000
ffff8806ab677ac0 2312976693 C Co:6:002:0 0 20 >
ffff8803a02ef940 2312979691 C Ii:6:002:2 0:1 20 = 11ff0f4e 00040000 00000000 00000000 00000000
ffff8806ab677940 2312979925 S Ii:6:002:2 -115:1 64 <
ffff8806ab677400 2312981207 S Co:6:002:0 s 21 09 0212 0001 0040 64 = 12ff0f3e 00040009 02ffffff 05ffffff 04ffffff 07ffffff 06ffffff 09ffffff
ffff8806ab677400 2312981696 C Co:6:002:0 0 64 >
